[{
    "ID": "1",
    "version": "RIFv1.0",
    "class": "RNA-RNA-Protein",
    "type": "basepairing",

    "evidence": [
        {
            "type": "experimental",
            "method": "gel shift assay",
            "data": {
                "URI": "https://journals.asm.org/doi/full/10.1128/JB.183.6.1997-2005.2001",
                "note": "Hfq and DsrA interact in vivo"
            }
        },
        {
            "type": "experimental",
            "method": "protein binding assay",
            "data": {
                "URI": "https://www.ncbi.nlm.nih.gov/pmc/articles/PMC1370368/"
            }
        }
    ],

    "partners": [
        {
            "name": "Hfq",
            "symbol": "Hfq",
            "type": "polypeptide",
            "sequence_type": "protein",
            "genomic_coordinates": "NC_000913.3:+:4400288-4400596",
            "organism_name": "Escherichia coli K-12 MG1655",
            "organism_acc": "NC_000913.3",
            "local_sites": {
                "dsrA": [[60,78],[45,55]],
                "rpoS": [[10,40]]
            },
            "info": {
                "description": "RNA chaperone that binds small regulatory RNA (sRNAs) and mRNAs to facilitate mRNA translational regulation in response to envelope stress, environmental stress and changes in metabolite concentrations.",
                "sequence": "MAKGQSLQDPFLNALRRERVPVSIYLVNGIKLQGQIESFDQFVILLKNTVSQMVYKHAISTVVPSRPVSHHSNNAGGGTSSNYHHGSSAQNTSAQQDSEETE",
                "note": "https://www.ebi.ac.uk/pdbe/entry/pdb/5I21"
            }
        },
        {
            "name": "dsrA",
            "symbol": "dsrA",
            "type": "small_regulatory_ncRNA",
            "sequence_type": "rna",
            "genomic_coordinates": "NC_000913.3:-:2025223-2025313",
            "organism_name": "Escherichia coli K-12 MG1655",
            "organism_acc": "NC_000913.3",
            "local_sites": {
                "Hfq": [[12,30],[80,90]],
                "rpoS": [[50,70]]
            },
            "info": {
                "description": "DsrA small regulatory RNA; riboregulator of RpoS and H-NS production",
                "sequence": "AACGCATCGGATTTCCCGGTGTAACGAATTTTCAAGTGCTTCTTGCATTAGCAAGTTTGATCCCGACTCCTGCGAGTCGGGATTT",
                "structure": "...(((((((.....)))))))..(((((((...(((((.....)))))...)))))))((((((((((....)))))))))).."
            },

            "custom": {}
        },
        {
            "name": "rpoS",
            "symbol": "rpoS",
            "type": "mRNA",
            "sequence_type": "rna",
            "genomic_coordinates": "NC_000913.3:-:2866559-2867551",
            "organism_name": "Escherichia coli K-12 MG1655",
            "organism_acc": "NC_000913.3",
            "local_sites": {
                "Hfq": [[200,230]],
                "dsrA": [[587,607]]
            },
            "info": {
                "description": "RNA polymerase, sigma S (sigma 38) factor",
                "sequence": "TGAGTCAGAATACGCTGAAAGTTCATGATTTAAATGAAGATGCGGAATTTGATGAGAACGGAGTTGAGGTTTTTGACGAAAAGGCCTTAGTAGAACAGGAACCCAGTGATAACGATTTGGCCGAAGAGGAACTGTTATCGCAGGGAGCCACACAGCGTGTGTTGGACGCGACTCAGCTTTACCTTGGTGAGATTGGTTATTCACCACTGTTAACGGCCGAAGAAGAAGTTTATTTTGCGCGTCGCGCACTGCGTGGAGATGTCGCCTCTCGCCGCCGGATGATCGAGAGTAACTTGCGTCTGGTGGTAAAAATTGCCCGCCGTTATGGCAATCGTGGTCTGGCGTTGCTGGACCTTATCGAAGAGGGCAACCTGGGGCTGATCCGCGCGGTAGAGAAGTTTGACCCGGAACGTGGTTTCCGCTTCTCAACATACGCAACCTGGTGGATTCGCCAGACGATTGAACGGGCGATTATGAACCAAACCCGTACTATTCGTTTGCCGATTCACATCGTAAAGGAGCTGAACGTTTACCTGCGAACCGCACGTGAGTTGTCCCATAAGCTGGACCATGAACCAAGTGCGGAAGAGATCGCAGAGCAACTGGATAAGCCAGTTGATGACGTCAGCCGTATGCTTCGTCTTAACGAGCGCATACCTCGGTAGACACCCCGCTGGGTGGTGATTCCGAAAAAGCGTTGCTGGACATCCTGGCCGATGAAAAAGAGAACGGTCCGGAAGATACCACGCAAGATGACGATATGAAGCAGAGCATCGTCAAATGGCTGTTCGAGCTGAACGCCAAACAGCGTGAAGTGCTGGCACGTCGATTCGGTTTGCTGGGGTACGAAGCGGCAACACTGGAAGATGTAGGTCGTGAAATTGGCCTCACCCGTGAACGTGTTCGCCAGATTCAGGTTGAAGGCCTGCGCCGTTTGCGCGAAATCCTGCAAACGCAGGGGCTGAATATCGAAGCGCTGTTCCGCGAGTAA",
                "structure": "(((((((((((.........)))).))))))).........(((((((..((((.((((((..(((((((((((.....))))))))))).......((..(((.(((((((((......((.....))...))))))))).)))..)).....(((((((((.((((((....((((((..((((((..(((((((.....))))..)))....))).)))..)))))).......))))))....((((((((((....(((((((..(((((((((((..((((.....))))))))))))))).....(((((((((.....)))..(((.((((((((...))))))))....)))...))))))...))))).)))))))))))).(((((((..((((((...)).))))...))))))))))))))))...((((((....))))))((((....(((((...............))))).....))))...))).))).))))........(((((.((((...((((((.((((((.((.(((((((........))))....))))).))))))......))))))..(((((((....)))))))..))))))))).(((((((((((....))))).)))))).((((....((((((....)).))))...))))...(((((((((((...(((.(((((.............))))).))).....))).)))......((((((..(((......((((((((((((.((((.....))))(((...((((.((((...((((((((((..((((((((((((..........)))))).)))))).)))))((((((......))))))(((........)))...))))).)))).))))..)))....)))))))).))))..((((((....)))))))))..))))))..))))))))))))......"
            },

            "custom": {}
        }
    ]
}
]



